{
  "$schema": "https://json-schema.org/draft/2020-12/schema",
  "title": "Claude Code / open-plugin manifest",
  "type": "object",
  "required": ["name", "version", "description", "author", "repository", "license"],
  "properties": {
    "name": { "type": "string", "minLength": 1 },
    "version": { "type": "string", "minLength": 1 },
    "description": { "type": "string", "minLength": 1 },
    "author": {
      "type": "object",
      "required": ["name"],
      "properties": {
        "name": { "type": "string", "minLength": 1 },
        "url": { "type": "string", "minLength": 1 }
      }
    },
    "repository": { "type": "string", "minLength": 1 },
    "license": { "type": "string", "minLength": 1 },
    "keywords": {
      "type": "array",
      "items": { "type": "string", "minLength": 1 }
    }
  },
  "additionalProperties": true
}
